artist_name	track_name	release_date	genre	lyrics	topic
old dominion	my heart is a bar	2019	country	reputation late night destination like kind vacation lose souls door open come lonely come break figure goin need leave sweepin floor heart closin drink tire bein shoulder havin heart closin closin oohooh come conclusion true illusion bein usin sick noise kill light boys band poison shelf farewell heart closin drink tire bein shoulder havin heart closin closin take fall makin heart closin drink tire bein shoulder havin heart closin closin heart closin drink tire bein shoulder havin heart closin closin woohoo closin woohoo closin woohoo woohoo woohoo woohoo woohoo woohoo	sadness
stick figure	above the storm	2017	reggae	felt light moon try scream silence look want live island good see smile understand world want live live live live live live see break cloud rain fall shin lose sound turn loud sound keep die wonder mystery think soul start fly want long live live live live live live close eye moment focus breathe think good thoughts hold slip dream slip away place storm rain away away wake want send like tale time have good time paint story life high hold years face fear afraid head rest wish best life bless today thank praise	personal
des rocs	let me live / let me die	2018	blues	know pain know dread wicked vein turn lead tear stop kill time dead eye leave kiss cobra kill time live live live live live live live live right like moment kill time fear dark thoughts yeah stop meet friend lonesome kill time live live live live live live live live whoa whoa live live live live live live live live	personal
nahko and medicine for the people	san quentin	2016	reggae	coastal california cradle city angels know know come easily return source light indefinitely tear drive hold scene check crazy greet release mental slavery walk yellow line penitentiary feel offshore wind come wink weep like waterfalls ocean grandfather bring medicine come long tell story turn angels come expect see crazy dream manifest say tooth tooth life life say tooth tooth life life humnumbaway away humnumbaway away wash away humnumbaway away humnumbaway away wash away sunrise know know half story forget chapter step closer need closure cross couple border mind torture warrior responsible dark past journey head heart think maybe grow pain eloquence grandmother come bring evidence come long tell story turn angels come expect see crazy dream manifest say tooth tooth life life say tooth tooth life life life life humnumbaway away humnumbaway away wash away humnumbaway away humnumbaway away wash away stranger come brother different child anger strength go tooth tooth life life say tooth tooth life life life life	personal
jon bellion	stupid deep	2018	rock	hop fight feel free things yeah attempt earn yeah cause hole inside heart stupid deep stupid deep try path try clear life plan yeah money hand need stupid cheap stupid cheap hop fight feel free things attempt earn yeah cause hole inside heart stupid deep stupid deep hop fight feel free things things attempt earn hole inside heart stupid deep stupid deep deep	sadness
white denim	good news	2018	blues	good news long time stay long telephone telephone cure blue call call room call reach want tell need need news late know wrong know time need long telephone telephone cure blue call call room call reach want tell need need good news long time stay long	lifestyle
breaking benjamin	feed the wolf	2018	rock	feel animal chain beast crawl inside hear violence sleep lose world lie feel suffer bury cold light fee inside skin devil close choke breath die help lyric commercial	dark
deap vally	bring it on	2018	blues	think come brink guess think upper hand cause time line draw sand bring bring bring yeah come bring bring trouble ahead get dangerous dance away like pray need grab horn bring bring bring come bring bring care go go gonna belong matter fast run come come bring bring bring come bring bring	lifestyle
zac brown band	start over	2017	country	darlin pack suitcase away start smoke wave cold corona know time fall turn phone tonight long catch life lose baby know light darlin pack suitcase away start smoke wave cold corona know time fall time fall catch plane leave long time baby know light darlin pack suitcase away start smoke wave cold corona know time fall time fall fall fall time fall sing darlin pack suitcase away start smoke wave cold corona know time fall time fall time fall time fall time fall time fall	sadness
killswitch engage	as sure as the sun will rise	2019	rock	hand certainty fulfill destiny soul light light course vein like river rain healer seeker true believer summon smite deceivers peril face overcome treacherous days overcome stand sure rise word fee humanity sacrifice demonstrate willingness hate strength healer seeker true believer summon smite deceivers peril face overcome treacherous days overcome stand sure rise give souls fat tonight brave live life pull darkness reborn light peril face overcome treacherous days overcome stand sure rise overcome sure rise	personal
oscar lee	méxico ácido	2019	hip hop	star horse cart world fall apart unleash hearts bring guitars untether capture dark leave get burn tumble desire stab wild gather choir sharpen plume starlight release moon leave get burn soften leave debt promise instead rapture deck burn	sadness
cafe jazz deluxe	zesty yearn music	2016	jazz	wait miss face room wait look moon emotional devotional greatest heaven hide live wait play silly game wait stand rain emotional devotional greatest heaven hide live emotional devotional greatest heaven hide live wait wait wait wait wait wait oanananana oananananoo	lifestyle
ballyhoo!	jameson & ginger	2017	reggae	brain brain brain brain brain brain brain brain brain late rent concern step firepit cause care burn cause drinkin drinkin sucker sucker shade friends think loser brain cause drinkin drinkin late rent concern step firepit cause care burn cause drinkin drinkin sucker sucker shade friends think loser brain cause care burn brain brain	dark
kongos	take it from me	2016	blues	mind wake recognize take minute clear head recall blank camera roll forget film start matter time minute cross line think mind mind mind stop hold think slow knock track stop hold think slow turn beast bolt split second late bring halt hypnotize feet follow shoe kinda like cigarette smokin start matter time minute cross line think mind mind mind stop hold think slow knock track stop hold think slow turn mind stop hold think slow turn	lifestyle
t-rock	what's stopping you (feat. unexpected)	2016	hip hop	stronger braver near failure doubt come bold unafraid brokenness knit perfectly child matter world eye need need honest fearless unashamed weakness stop compare promise want brokenness knit perfectly child matter world eye need need strongest weakness free stronger braver know gonna matter brokenness knit perfectly child matter world eye need need need okay	personal
temporex	nice boys	2017	rock	easy feel nice miss want feel lyric commercial	emotion
cole swindell	break up in the end	2018	country	walk little drink drink kiss shuffleboard break introduce think leave room advice move break know away know best worst mistake break play favorite song felt like hear ruin break know away know best worst mistake girl break tonight call cause lonely okay know come break break	sadness
thievery corporation	music to make you stagger	2018	jazz	catch tide divide moment stand fight future bright burn inside hand fell line time fail forget reality insanity humanity tear seam aaaah go go aaaah gonna gonna blind devotion shade inside hearts tie break lie pull apart time steal dream reality insanity humanity call free aaaah go go aaaah gonna gonna aaaah go go aaaah gonna gonna turn away promise aaaah go go aaaah gonna gonna aaaah go go aaaah gonna gonna	sadness
bob weir	lay my lily down	2016	blues	hole hole meadow hole cold cold grind hole hole meadow time newborn girl pull moma hair come window know hole hole meadow hole cold cold grind hole hole meadow gonna sleep child come learn laugh hell cause pharoah daddy blood run vein hole hole meadow hole cold cold grind hole hole meadow time little star windswept pearlhandled pistols banjo knee hole hole meadow hole cold cold grind hole hole meadow hole hole meadow hole cold cold grind hole hole meadow	dark
charlie parr	hobo	2016	blues	want dead book start read bear follow step tread know flee somebody tell somebody tell go somebody spend minute pray hobo go wrong song sing contain refrain change remember face maybe somebody tell somebody tell go somebody spend minute pray hobo go wrong life long hours long breathe close eye roll miss somebody tell somebody tell go somebody spend minute pray hobo go wrong woods end live lake know come somebody tell somebody tell go somebody spend minute pray hobo go wrong	emotion
local natives	dark days	2016	pop	finally come finally hop race home house look black white dark days summer million ways line holy seventh sign go hand hand fear afterlife fight fight know dollar strong rely turn corner know sight dark days summer rain water fine wild combination right line go hand hand fear afterlife fight fight know long long	dark
peach pit	alrighty aphrodite	2018	rock	seat clamshell oceans feel dark swell crawl skin spine know sell maybe waste alrighty lyric commercial	dark
the score	on and on	2017	rock	play finger hurt write word wanna moment slip away hard place hard catch fell like everybody say last forever hang tight try tie everybody say last forever hang tight try tie heart beat heart beat heart beat hold like photograph lyric commercial	sadness
filmore	heart's having a hard time	2018	country	think weight chest night say couldn think break wouldn better start think easy hat cause afraid hurt think good goodbye heart have hard time hard time make sense right inside yeah know mind heart heart have hard time shouldn tough change lock screen sink kiss smile million reason leave think feel feel hat cause afraid hurt think good goodbye heart have hard time make sense right inside yeah know mind heart heart have hard time miss wish work wrong love hat cause afraid hurt think good goodbye heart have hard time make sense right inside yeah know mind heart heart have hard time heart have hard time	sadness
esperanza spalding	touch in mine (fingers)	2019	jazz	touch surface feel spark tenderness touch touch touch touch touch touch touch touch touch touch touch touch vibrational current fingertip unseen dip subtle hand flow neural connection sing touch touch touch touch touch touch touch touch touch touch touch follow blind fingertips feel roam lips unwrap delicacy fold silence touch touch touch touch touch touch touch touch touch touch touch touch vibrational current fingertip unseen dip subtle hand flow neural connection sing	emotion
camila cabello	crying in the club	2017	pop	think know tell fear forever true true true arm tonight music lift like high open heart music lift like free feel sunrise music warm body like heat thousand fire heat thousand fire cry club beat tear fall baby cry club little tear turn ecstasy cry club cry club cry club think know tell fear meet pure true true true arm tonight music lift like high open heart music lift like free feel sunrise music warm body like heat thousand fire heat thousand fire cry club beat tear fall baby cry club little tear turn ecstasy cry club cry club cry club think know tell fear forever true true true say cry cry club cry say cry cry club cry woah cry club beat tear fall baby cry club little tear turn ecstasy cry club cry club cry club cry club cry club	sadness
cafe jazz deluxe	coffee houses	2016	jazz	hear scream black bruise beat blow need blood sweat skin bone rage rattle cage say easy strong survive ready stand ready hangman hear scream like want hear yell like mean go loud strong proud hard home hear hear hear hear hear scream pull push right place wipe smile right face watch break blink miss leave ready fight ready hear scream like want hear yell like mean go loud strong proud hard home hear hear hear hear hear scream hear scream like want hear yell like mean go loud strong proud hard home hear hear hear hear hear scream hear scream like want hear yell like mean go loud strong proud hard home hear hear hear hear hear scream	lifestyle
shovels & rope	c'mon utah!	2019	blues	thirsty lose hang cross die colorado bone saddle weary battle path difficult follow come utah turn dial come come utah raise ledge wanna like real american wall come go lose ones move gather tell story utah calico mane stride cannon morning saunter fell eye mix music climb light track yell loud everybody know say come utah raise ledge albuquerque santa grande yeah come utah weary mile jealous child skin steep arm weak breath leave wind water pack horse like cannon thirsty lose hang cross die colorado	dark
justin bieber	friends (with bloodpop®)	2017	pop	inception sound break fault line grind devil come idle hand quiet peace wait soul sleep devil come pure deception paint clean vacant flesh lucid dream devil come devil come spirit breathe devil come feet come shallow water hold underneath devil come world paint need devil come fold second flat throw heart black devil come devil come spirit breathe devil come feet come shallow water hold underneath devil come devil come spirit breathe devil come feet come shallow water hold underneath devil come inception sound break fault line grind devil come	dark
cass mccombs	bum bum bum	2016	rock	white farm breed leash tear flesh teach think hear blood streets eternal river know killer count silver ambush reeds seed white breed blood streets blood employ away lyric commercial	dark
reignwolf	over & over	2019	blues	animals woods stick outside look analyze note criticize hear voice scream stick inside lose maze waterfalls push pull waterfalls push pull learn learn cheat razor blades hard hear voice scream try punch like taste read lips head pretend like know say animals battlefields desert disappear like wheel face fear face tear long come undo ocean care know lick bone bleed brain make difference sleep walkin sleep talkin mmmmm sleep walkin sleep talkin sleep walkin sleep talkin	dark
lenny kravitz	everything	2019	rock	origin essence lifeline eternal destination sweetness soul valley dark cold bless child need need tire naked think grab hold situation	dark
tim mcgraw	the rest of our life	2017	country	sit dark room warm fireplace know brighten past right hand plan rest life thing give give worryin life fine hair show fine waistline grow fine time take toll stay young rest live make plan children look eye name pick daughter thing give give worry life fine hair show fine waistline grow fine time take toll stay young rest live care cloud brew long young young young fine hair show fine waistline grow fine time take toll stay young rest life stay young rest life stay young rest life	personal
blues saraceno	the river	2019	blues	lord soul river devil come home river lord hand save gallows hear news gold shallow evil come wicked shall rise river sand gonna clean river lord hear blood valley deliver worry devil hand gonna strike grave river song gonna pull river save lord soul river devil come home lord soul river lord soul river lord soul river devil come home lord soul river devil come home river lord soul river river devil come home river	dark
riley green	that's how ya left me	2018	country	bare foot run driver door stain concrete back street think real hard chase watch taillights fade know boot feel  heavy leave leave leave like leave small road fade like favorite song radio leave like leave warm drink right like seat light come barely breathe watch leave lonely leave funny start right mornings scream cuss beat dash beat piece junk hop hear midnight train hold dogwood maybe time think turn leave like leave small road fade like favorite song radio leave like leave warm drink right like seat light come barely breathe watch leave lonely yeah leave decide wanna come cause know leave look pretty leave leave leave like leave small road fade like favorite song radio leave like leave warm drink right like seat light come barely breathe watch leave lonely leave yeah leave	sadness
jd mcpherson	on the lips	2017	blues	dream like memory onetime kiss tiny shadow autumn moonlight takin items list finally lips blow like sink ship time burn forget feel tingle knees fingertips memories fade away ease kiss lips lips lips lips songs humdrum hop rain pour hold charm hand little gleam shine like candle dumb deaf freeze breath melodies fade away ease lips lips lips lips lips lips lips lips	emotion
michael franti & spearhead	still standing	2016	reggae	time grind look say listen word sign wanna change wait life begin gonna start minute train come gonna jump leave like yesterday leave like yesterday leave like yesterday leave like yesterday long long road stand today care anybody cause stand stand today stand stand stand stand stand stand stand today stand stand stand stand stand stand stand today eeeyooh eeeyooh yoohooh yoohooh time feet look say think sign say walk wait life begin gonna start minute train come gonna jump leave like yesterday leave like yesterday leave like yesterday leave like yesterday long long road stand today care anybody cause stand stand today stand stand stand stand stand stand stand today stand stand stand stand stand stand stand today train come gonna jump leave like yesterday leave like yesterday long long road stand today care anybody cause stand stand today stand stand stand stand stand stand stand today stand stand stand stand stand stand stand today	dark
tribal seeds	empress	2017	reggae	city sinners need open heart feel pity open weak unfazed unscathed dreadlock daughter mission live cause travel desert travel scorcher hear wisdom mesmerize voyage lay eye mythical kingdom hear couldn understand jerusalem stand wisest fulfill role covenant empress invite empire deepest desire universe conspire empress invite empire deepest desire universe conspire night starlight reveal sign come arise uplift world dawn burn burn wicked discern burn burn sight queen return build wisdom youth bring right foolish political leadership fight wickedness repel evil force abroad stand wisest fulfill role covenant	dark
seedless	it's always something	2016	reggae	know hard mind know tough leave ones people change hear start believe feel sicker hit everyday allow souls wither turn blue sky liquor smoke days away stray sleepless nights drunken fight couldn toss aside selfdestructive pride grow life tough fall luck know hard mind know tough leave ones toxic know go live like toxic wonder amiss sleepless nights drunken fight couldn toss aside selfdestructive pride grow life tough fall luck separate paths go life guess separate paths look feel people change hear start believe people change grow hear work start believe people change burn jade misplace allegations hear think time start believe move people change grow hear work start believe people change burn jade misplace allegations hear think time start believe move people change grow hear work start believe people change burn jade misplace allegations hear think time start believe move	personal
thee oh sees	gelatinous cube	2016	blues	stand cannibal eye meal come wander xmachine room cube lay murderer tool xmachine room cube lay murderer tool stand cannibal eye clock tick wander	dark
kelsea ballerini	unapologetically	2018	country	gonna fell fast gonna gonna late away yeah gonna kind hold hand gonna understand surface look pretty face wrong right sight matter take break second start fall faze crazy care careless wreck reckless fall apart halfhearted yeah maybe true know know maybe shin matter take break second start fall faze crazy life party keep eye starry sorry sorry yeah matter take break second start fall faze crazy gonna fell fast yeah gonna gonna	sadness
vince staples	big fish	2017	hip hop	want know say want want late night ballin countin hundreds thousand late night ballin countin hundreds thousand late night ballin countin hundreds thousand late night ballin countin hundreds thousand late night ball past misfortune sleepin late nights eatin squeeze real artesian round corner norf norf soldier slide right slide morning story young black tryna  band plan lyric commercial	lifestyle
don philippe	the world connects	2016	jazz	buju banton yout brownin song hear tell cause cyant shoe tongue grun hear stop black woman girls dark complexion cause stop black woman nuff ting gwan complexion black beauty colla million birth natural smooth lika grape true lotion teki teki care complexion whola plan wrong bcaw black woman stop black woman girls dark complexion cause stop black woman nuff ting gwan complexion true lite skin want woman baddah worry intension wedah black buju right spead nation backitive buju banton stop black woman girls dark complexion cause stop black woman nuff ting gwan complexion black proud folla buju banton shout loud black stand crowd like line behin dark cloud stop black woman girls dark complexion cause stop black woman nuff ting gwan complexion	dark
surfaces	heaven falls / fall on me	2018	pop	wake early mornin feel light open window shadow banana pancakes problems jam johnson swear hear call outside heaven fall heaven fall heaven faaaalls heaven fall heaven fall heaven faaall nothin like color couldn paint better good time horizon couple bird come fee swear hear call outside heaven fall heaven fall heaven faaaalls heaven fall heaven fall heaven faaall heaven fall heaven fall heaven faaaalls heaven fall heaven fall heaven faaall fall fall fall fall fall fall fall fall	sadness
mitch rossell	ask me how i know	2019	country	stubborn come settle stick rule ways gotta freedom gotta space meet girl swear start feel things felt spend time try figure hold start fall hold pride start build wall inside push away cause know leave know shake head tell wrong fool song know cause know meet girl swear start feel things felt spend time try figure hold start fall hold pride start build wall inside push away cause know leave know best song repeat maybe like meet girl swear start feel things felt spend time try figure hold start fall hold pride start build wall inside push away cause know leave know	sadness
morgan evans	things that we drink to	2018	country	gonna raise tall glass tonight look life live yeah things drink roads choose friends turn miss hearts break word ones line cross ones tear cry dream dream star burn star reach picture stories tell moments gonna raise tall glass tonight look life live yeah things drink shed little light memory kinda make feel like little lose yeah things drink hurt heal songs sing know tomorrow bring battle fight war pain things drink things drink gonna raise tall glass tonight look life live yeah things drink wonder time go change thing tryna miss yeah things drink things drink things drink tryna miss yeah things drink	personal
the wood brothers	this is it	2018	blues	things think miss miss shouldn miss dream free miss change world change world need things think know things know know change world change world need wanna know eitheror yeah things think miss things think miss change world change world change world change world need need need	personal
louis armstrong	life is so peculiar	2016	jazz	life peculiar write burkejimmy heusen note marksarmstong scat life peculiar rain know mmhmm warm complain compain morning breathe yeah look mirror comb hair breakfast food life peculiar stay home brood lifetell pop peculiar desert sand grand oceans waterand drink know stand dinner wear clothe sleepy doze yeah thirsty drink life peculiar make stop think life peculiar sure fork belong knife sure corn beef lose cabbage cabbage husband wife life peculiar everybody say life life life peculiar ahugh usually sing oyster orleans rampart street sure thing tire restin walk walk care listen talk mouth shut airplane mmhmm life peculiar wonder life peculiar sure fork belong knife know mmmm corn beef lose cabbage leftover cabbage yeah husband wife yeah life peculiar everybody say life life hear time life life yeaaah	personal
devin townsend	spirits will collide	2019	jazz	okay word remember word calm remember young remember strong dues friend play foolish game friend rise fear pain forget love forget hard remember flame heart burn strong remember spirit collide remember remember death rise receive pain end forget perfect forget strong flame heart burn strong brave start remember spirit collide remember remember	personal
jake owen	i was jack (you were diane)	2019	country	yesterday years singin word radio kinda like songs save souls someway fallin fast jumpin blue halo hangin wind american kid like time play blow away turn sing time hear song like like close eye laugh memories pack cheyenne lyric commercial	lifestyle
drake	i get lonely	2019	pop	wait long days january sit say email today kind think forget wanna like lonely baby know time tell anybody lonely place face face rule like lonely like lonely like lonely ready steady like long friend wanna come strong cause people wanna know gotta like lonely baby know time tell anybody lonely place face face rule like lonely like lonely like lonely lonely baby know time tell anybody lonely place face face rule like lonely like lonely like lonely lonely lonely like	sadness
sticky fingers	angel	2016	reggae	live life golden disguise fall swim deepest ocean wise stone sentimental cause home head strong move wise stone blind break hogtied soft speak stiffly stir awake throw bone throw bone cook alive sleep drown mess pull wing live life golden despite omen shiver coldest wise stone wise stone wise stone cook alive sleep drown mess pull wing cook alive sleep drown mess pull wing say sorry	dark
