artist_name	track_name	release_date	genre	lyrics	topic
loving	the not real lake	2016	rock	awake know go see time clear world mirror world mirror magic hour confuse power steal word unheard unheard certain forget bless angry weather head angry weather head angry weather head know gentle night mindless fight walk woods	dark
incubus	into the summer	2019	rock	shouldn summer pretty build spill ready overflow piss moan ash guess smite leave remember call forever shouldn summer summer like coil vine break crack wall fruit distil step line remember call forever shouldn summer remember call forever remember end blind shouldn summer shouldn summer shouldn summer summer remember call forever shouldn summer remember call forever remember end blind	lifestyle
reignwolf	hardcore	2016	blues	lose deep catch breath think say try break wall mama leave hardcore hardcore think brother say lock bedroom sister say throw away world stop hell think say try break wall think hardcore hardcore think time think like anymore try break wall think hardcore hardcore think say try break wall mama leave think hardcore hardcore think	sadness
tedeschi trucks band	anyhow	2016	blues	run bitter taste take rest feel anchor soul play game rule learn lessons get choose turn walk away walk away anytime anytime wake feel adrift piece miss realize push follow lose place deal wreckage soul turn walk away walk away anytime anytime care loan dime sorry cost time expect desperate flame turn walk away walk away anytime anytime anytime anytime anytime anytime anytime anytime anytime anytime	sadness
lukas nelson and promise of the real	if i started over	2017	blues	think think different set apart sober mind sympathetic hearts swear oath swear oath know life play play distance great height sure kill innocents build drop death longer human be longer people target screen real drop death tell send send chaplain say say say shut mouth sure kill innocents build drop death longer human be longer people target screen real drop death tell tell safe shoot dream justify resolve rise avenge innocent defend ones survive ask	dark
tia ray	just my luck	2018	jazz	yeah happen real drink drink turn shots lose count kind luck know friends house sound silly sound stupid sentence break word get fluid listen stop ahead fool past minutes yell phone middle beg kiss luck machine luck pick luck remember morning luck call luck go sleep luck remember morning sweet vodka purse beach know stand feet plus look thing like fake feel silly feel stupid sentence slur word confuse listen stop ahead ahead fool past minutes yell phone middle beg kiss luck machine luck pick luck remember morning luck call luck go sleep luck remember morning cause luck machine luck pick luck remember morning remember single thing morning baby luck call luck go sleep luck remember morning	emotion
rebelution	trap door	2018	reggae	 long long road occur look shortcut wanna cause scene wanna close okay outspoken look trap door sneak grind floor careful wish need answer head time solve problems scream perfect expect human look trap door sneak grind floor careful wish	dark
thank you scientist	the amateur arsonist's handbook	2016	jazz	quick think good true worst best things forever pessimist drag complicate feel fear tell reason nice slow tell tell reason reason yeah hell understand lose win hand burn walk away hand satisfy notion break justify evidence lose things pretend pardon earth search solid grind fear tell reason nice slow tell tell reason reason yeah hell understand lose win hand burn walk away hand hear word black white mean hear hear word black white mean hear say ohhh say leave gonna leave poison say say gonna leave poison say leave gonna leave poison ohhh ohhh ohhh hell hell understand lose win hand burn walk away hand ohhhhhhhhhhh ohhhhhhhhhh	dark
zayde wølf	gladiator	2018	rock	start climb face army vipers lions reach cause time tear kingdom liars jail heart pessimists nail mouth impressionists spend money therapist couldn accept gladiator gladiator gladiator pick fight gods giant slayer boneshaker dominator freight train wreck ball gladiator tell think believe catch crossfire trouble single feel gold underneath lock doors second catch breath cause heart jumpin chest know give cause see best time accept gladiator gladiator gladiator pick fight gods giant slayer boneshaker dominator freight train wreck ball gladiator reason fight reason fight shake hand devil night tell reason fight gladiator gladiator gladiator pick fight gods giant slayer bone shaker dominator freight train wreck ball gladiator gladiator gladiator pick fight gods giant slayer bone shaker dominator freight train wreck ball gladiator	dark
eli young band	never land	2017	country	word yeah wreck roll lips high good get bottle right right wanna feet cold hard floor kiss steal wanna steal right palm hand fall fall like land head heartbeat hit feel like gravity exist wanna stop know fall fall like land hang like dance stretch song long float like make memories night night wanna feet cold hard floor kiss steal wanna steal right palm hand fall fall like land head heartbeat hit feel like gravity exist wanna stop know fall fall like land fall like land stay get fly wanna feet cold hard floor kiss steal wanna steal right palm hand fall fall like land head heartbeat hit feel like gravity exist wanna stop know fall fall like land fall like land fall like land fall fall fall like land fall fall fall like land fall fall fall like land	sadness
klim	ninetofive	2018	jazz	nice place think sky separate nice surprise know life like bring life help gentle kiss good night innocence pray humble amaze beautiful little miracle life gift think live life live bring life help simple kiss good night innocence crave waste time cause pain life everyday yeah yeah light shine promise baby wanna leave light cross heart hand best friend promise light	personal
terror squad	rudeboy salute (feat. buju banton, big pun and fat joe)	2017	hip hop	grain sand weak blood stain try bottomless hourglass board piece pawn try reach eighth rank sacrifice kings queen field sorrow lose life stand right leave field sorrow grave wife stand right rest wild roses wasteland defy desert throw grave memories gentle nature long forget field sorrow lose life stand right leave field sorrow grave wife stand right rest field sorrow soil want blood tear field sorrow minutes feel like years remember little time kingdom dead field sorrow lose life stand right leave field sorrow grave wife stand right rest field sorrow soil want blood tear field sorrow minutes feel like years remember little time kingdom dead remember little time dead	dark
devin townsend project	truth	2016	jazz	warn money money money money hallelujah hallelujah yeah hello learn live fear peace beauty unfold change home	personal
vampire weekend	unbearably white	2019	rock	baby pull away unbearably buff mountain sight snow peak unbearably white city freeze elegant flow wind doorway unbearably cold walk bedroom write notebook unbearably white avalanche come cover eye think want surprise hard body hard mind learn keep darling lyric commercial	dark
khalid	winter	2017	pop	lose heart nighttime leave cold leave break weary drink lie tell fell morning get cold life lonely city paso days harder november grow colder winter things remember promise promise promise grow colder winter promise lose mind leave quick reject time fell hard admit feel wasn mutual live lonely city paso days harder november grow colder winter things remember promise promise promise grow colder winter promise promise promise promise promise promise promise promise promise promise promise promise promise promise promise promise promise promise promise promise promise days harder november grow colder winter things remember promise promise promise grow colder winter promise	personal
rend collective	counting every blessing	2018	rock	blind see colour dead live forever fail redeemer bless measure lose father change ruin treasure give future bless measure count bless count bless let trust count bless count bless surely season good oooh good oooh good valley shadow depth sorrow lyric commercial	personal
post malone	spoil my night (feat. swae lee)	2018	pop	come spoil night feelin come play thinkin happen time spoil night spoil night spoil night night spoil night spoil night necklace natural glow dancin strobe  spoil night spoil night spend cash lose toxic take robe yeah couldn drop plenty money thighs plenty room ride like small take life spoil night spoil night spoil night night spoil night spoil night come spoil night spoil night feelin come play thinkin happen time yeah walk party like know spot mama wall jabronis point bring bring face beautiful boobies diamonds teeth teeth smilin think like jumanji jumanji time postmate plan whippin phone know know  videos post everybody gram gonna know girl home line blow yeah know doin right need spoil night need need spoil night spoil night spoil night night spoil night spoil night come spoil night spoil night feelin come play thinkin happen time yeah spoil night spoil night spoil night spoil night spoil night spoil night	lifestyle
albert hammond, jr.	rocky's late night	2018	blues	darker longer right fear tonight decide everybody feel alright mistake tonight leave companion enjoy polite leave strand confront right emptiness wasn take doubletime perfection break leave rearrange pretty tell  inside think round drink question blank watch begin sentence emptiness take doubletime lack perfection break leave rearrange	sadness
the record company	feels so good	2016	blues	wanna right today lookin wanna right today tire bein stun somethin control control control taste lips want want want come feel good feel good feel good doin want know shouldn feel good feel good feel good doin want know shouldn turn green light babe yeah turn green light babe yeah somethin control control control taste lips want want want come feel good feel good feel good doin want know shouldn feel good feel good feel good doin want know shouldn come babe feel good alright whew come yeah baby polite polite yeah hold arm hold arm time hold arm time hold arm yeah feel good feel good feel good doin want know shouldn feel good feel good feel good doin want know shouldn doin want know shouldn doin want know shouldn feel good feel good feel good doin want want want want baby yeah alright whew	emotion
kygo	stole the show	2016	pop	darling darling turn light watch watch credit roll cry cry know play house house heroes villains blame wilt roses stage thrill thrill go debut masterpiece curtain hold applause wave crowd final time steal steal steal steal steal steal darling darling know sell kiss fade band play cry cry roll heroes villains blame wilt roses stage thrill thrill go debut masterpiece line read perfectly curtain hold applause wave crowd final time steal steal steal steal steal steal steal steal steal steal	sadness
lp	muddy waters	2017	rock	kneel rivers edge tempt step follow closer right feel gnaw corner mind come blind worst kind ohoh muddy water fall ohoh muddy water crawl hold hold sell lyric commercial	dark
we are messengers	magnify	2016	rock	try sense sorrow feel hold life thing real scratch surface barely taste glimpse draw heart change sight lay waste need away magnify open open eye away magnify open open eye sight incomplete look small star problems long realign leave glimpse draw heart change sight lay waste need away magnify open open eye away magnify open open eye greater worry life stronger weakness mind louder come alive magnify greater worry life stronger weakness mind louder come alive magnify away magnify open open eye away magnify open open eye	sadness
peter bradley adams	my arms were always around you	2017	rock	fool time place little break pretty little wing get tire try feet grind days beneath northern light dance free like little child think leave arm awake time watch sleep straight night dream sacrifice heart safe guard life think leave arm arm think leave arm arm arm	sadness
imagine dragons	mouth of the river	2017	rock	mouth river mouth river mouth river wanna live life like live life faithful wanna floor everybody wanna wanna want enemies curse live life live live live mouth river wrath giver hand sinner mouth river woah mouth river woah wrath giver woah hand sinner woah mouth river sick alkaline lyric commercial	dark
t-rock	be a g about it	2016	hip hop	잊어버리지마 잃어버리지마 잊어버리지마 잃어버리지마 멈췄으면 잊어버리지마 잃어버리지마 잊어버리지마 잃어버리지마 바라보는 영원하길 기억해주길 한번쯤은 돌아보길 바라봐주길 baby 잊어버리지마 잊어버리지마 잊어버리지마 romanization neowa eonjenga nami dwieodo yeongyeong daheul eomneun doeeodo ijeobeorijima ilheobeorijima hoksina dareun saramui japgo isseodo yeongyeong daheul eomneun gose isseodo ijeobeorijima ilheobeorijima ttatteuthae bori matdaheul ttae salmyeosi sirin jabajul ttae chagaun sesange jichin mameul ongiro gamssane nune damgin neoui eolgul pume jamdeun neoui moseup idaero kkwak jabeun nohchimyeon andwae neowa eonjenga nami dwieodo yeongyeong daheul eomneun doeeodo ijeobeorijima ilheobeorijima hoksina dareun saramui japgo isseodo yeongyeong daheul eomneun gose isseodo ijeobeorijima ilheobeorijima maju neol baraboneun jigeumi yeongwonhagil barae hoksina sigani uril jiltu halkka sasil geokjeong dwae byeonchi yeongwonhi hamkke eonjenga gieokhaejugil hanbeonjjeumeun dorabogil budi nochi marajwo uril gyesok barabwajugil sigani jina baby neowa uriga nami dwieodo ijeobeorijima ijeobeorijima norael ijeobeorijima english estrange someday meet forget lose hold hand forget lose warm cheek meet hold freeze hand gently hug heart wear cold world warmth face eye sleep arm stop like hand hold estrange someday meet forget lose hold hand forget lose moment sit facetoface look forever time envy actually worry change forever remember someday look look forever time go baby estrange someday forget forget forget song	personal
dr. john	the bare necessities	2016	blues	look bare necessities simple bare necessities forget worry strife mean bare necessities mother nature recipes bring bare necessities life wander roam couldn fonder home be buzzin tree look rock plant glance ants maybe bare necessities life come look bare necessities simple bare necessities forget worry strife mean bare necessities rest ease bare necessities life relax backyard like act work hard spend time look want live think bout tell true bare necessities life bare necessities life come walk pounce roof talk bout bare necessities life wisdom understand sleep bare necessities life	personal
nappy roots	these walls (dirty mc edit)	2019	hip hop	hmmmmmmmm wall closin long suppose grin lose forgive hmmmmmmmmmm wall closin long suppose grin lose forgive hmmmmmmmmmm darkness approach fumble blunt roach look hopeless totally unfocused stumble porch poasty closest associate break couple sell dope humble folk come grow folk dumb slow poke hours death grow close live utmost plus extra point visualize gold post eat duck roast live live utmost cause pressure point lyric commercial	personal
dirty heads	diamonds & pearls	2017	reggae	say wanna outside today say wanna real high today catch vibe today eye today world handstand upside world handstand grind hate allergic fake verdict pray virgin yeah version purchase birth pray verse surface kiss gram  brain better thing sing rain claim wonderful world yeah  diamonds pearl yeah understand live understand life beautiful wonderful world yeah  diamonds pearl yeah understand life beautiful wonderful wonderful doin doin doin climb boat movin take doubt removin beautiful life provin feel know good high things misunderstand feel like good like gotta gotta cause plan rendezvous people understand  attitude time foolishness apologize cause people ruthless upset wonder takin runway wrong away days mark spot money lay beautiful life lovin think forget lovin provin cause come wonderful world yeah  diamonds pearl yeah understand live understand life beautiful wonderful world yeah  diamonds pearl yeah understand life beautiful wonderful wonderful understand life beautiful wonderful wonderful wonderful	personal
imagine dragons	walking the wire	2017	rock	feel away oohoh oohoh know line walk oohoh oohoh turn come come rag oohoh oohoh afraid fall look oohoh oohoh take step take leap come come feel wind hair feel rush walk wire walk wire couldn higher walk wire wire wire nights walk away oohoh oohoh tear tear fade oohoh oohoh lyric commercial	sadness
breaking benjamin	psycho	2018	rock	feel daylight choke vile forever change cold eternal light ember fade scar hide fake hollow darkness close silence forsake cold eternal light ember fade scar hide fake psycho warm embrace psycho faithful rupture break cold eternal light ember fade scar hide fake psycho warm embrace psycho faithful rupture break	sadness
popcaan	traumatized	2019	reggae	screamin lorax gang deffame california condors leftame unlock factory farm yeah free mountain gorillas elephants recipe say recipe yeah recipe farmers market mind depressin orphan orangutans ride enemies recipe go marx lorax marx warnin switch planets orbit axin bring lorax plant seed rainforests turn ash bricks speak tree tongue accurate grip squeeze consumerism till choke handle quick iconic posse ready bust competition stack proboscis monkey genetic kina dyin borneo reconcile sinsa dyin borneo alonea dyin borneo come homea dead borneo people seuss message looraaxes like care awful go better palm plantations smoke cause steal rightfully theirs people cause care leave homeless extinction near lush green turn orphan roam family hopeless grind look entertainers chop knives enrichment center pacify traumatize inside lie cage pet sale protein fill rivers piss suffer joke resources go smoke watchin nutella lie plop watch oreo lie crunch watchin kitkat lie munchout tell girl scout watch watchin popcorn lie nestle lie leak watchin drumstick lie drop lie seep imma kill culture killers rebuild forest food medicine sustainably senseless warrin color orange equality mandatory mentality shut balcony orangutan molotov beat like marchin hemp plant lorax army safe cherrywood floor crack orangutan lorax	dark
greta van fleet	the new day	2018	blues	shine light shake nights dark free tomorrow bright believe righteous come true child garden grow watch bloom dream forget woman soon greed need go unspoken leave fade away pain vain mean heart break pain mean heal know live try future hard know suture child garden grow watch bloom dream forget woman soon greed need go unspoken leave fade away pain vain mean heart break pain mean heal fade away fade away	sadness
mumford & sons	the wild	2018	rock	burn death make kind come sparkle mind earth tie knot lyric commercial	dark
dispatch	so good	2018	reggae	wait long rise afternoon eye open world shin feel good feel good feel good feel good believe live heart light open world shin feel good feel good feel good feel good open world shin feel good feel good feel good feel good little frog yellow feet jump wanna speak little pumpkin wind thank comin ladies gentleman radio cause feel good feel good feel good	emotion
cody johnson	kiss goodbye	2016	country	slide ignition truck strike hard heaviness situation eye fix small silver half heart keychain give dangle dashboard light read word forever wanna turn radio turn county road pick like thousand time gravel underneath tire half mile stretch barb wire drop rain fallin know pain know reach hold hand feel baby time press lips hold tight know kiss kiss goodbye like gonna okay gonna break heart know kiss kiss goodbye important gotta know understand hell understand pull house feel head spinnin thinkin change step door little certain step know know know gotta reach hold hand feel baby time press lips hold tight know kiss kiss goodbye like gonna okay gonna break heart know kiss kiss goodbye reach hold hand feel baby time press lips hold tight yeah like gonna okay gonna break heart know kiss kiss goodbye goodbye	emotion
george strait	take me away	2019	country	wild horse couldn drag away today tonight time girl gonna happen wonderin askin farthest thing mind place girl happenin pull fast ones gonna away away gonna away girl hand wanna suit fine talk gonna walk lock eye right like like star fly moon shin perfect time gonna away away gonna away baby gonna break chain strongest wind hurricane gonna away away gonna away breath neck right tear head spinnin round faster cause know gonna away away gonna away away gonna away	sadness
parker millsap	hades pleads	2016	blues	gonna house styx long black train go clacketyclick beg like cerberus beg like beggin gonna garden scream belly voodoo machine pick darlin black limousine knockin gonna line want pretty girl rule underworld coal diamonds string black pearl gonna crown queen dead goldcapped teeth ring head hear river burial listen gonna line	dark
black pistol fire	hard luck	2016	blues	cold smoke river shore take breath hardly choke weepin moan like lonesome ghost kerosene soak foot rope cold heart follow line north apple darling know want bite lose mind daddy dime county line shack rope kindly remove heart jaw cold heart follow everwhere line north apple darling know want bite know know know heaven ramble know know know heaven ramble hook line sinker baby lord know need maybe look need save pretty soon push daisies cold heart follow line north apple darling know want bite know know know heaven ramble know know know heaven ramble	dark
through the roots	catch a flight	2019	reggae	young wasn naive watch helpless turn leave pain past deep bury try time think think blind couldn couldn love know die fall asleep hop dream like nights like slowly fleet disappear reality crash floor	sadness
migos	kelly price (feat. travis scott)	2017	pop	tracklist look xxxtentacion tshirt migos gucci mane right witcha migos paper migos time gucci mane sacrifice migos party gucci mane usher tokyo madeintyo decemba remix divine council ilkmoney andré zoom future move mask future reminder weeknd weeknd pull stick sahbabii bounce tunnel vision kodak black flight sightadvanced cudi migos migos drown water boogie hoodie kodak black cast migos draco future feel come weeknd daft punk design cudi andré grizzley	dark
ajr	break my face	2019	rock	okay mouth tongue fell right grind drown mouth kill make ugly life give lemons give okay break face look great face face okay break face darkest face face okay lyric commercial	dark
tedeschi trucks band	keep on growing	2016	blues	leave play streets unknowing fleet lately dreamer look look away young girl shake stage walk right life doorway story gotta grow grow grow yeah stand steer face lover feel strange grow treat understand take hand tell lose say gonna alright grow grow grow yeah baby baby know leave huge walk hand inhand forever know time go change lord know lover go grow grow grow overdue gotta grow grow grow yeah gotta grow grow grow yeah	personal
i dont know how but they found me	do it all the time	2018	rock	take world kiss time take girl make reason want time take world little victimless crime take innocence corrupt mind need want time time lyric commercial	personal
riley richard	l.i.t.	2018	jazz	libertin class roster spring study twentieth century british literature shippensburg university pennsylvania branch brannen conzo  hervochon hogue kearney mill mosior plenskofski tegan rhode anjenae richardson sarabeth sheriff stufflit woodlief	lifestyle
los cafres	revolution	2019	reggae	know mean revolution take solution fight oppression batter depression ready stand fight right revolution ready stand fight like soldier call choose call choose fight right fight time ready stand fight right revolution ready stand fight like soldier call choose call choose wanna live live live live live live forever gotta live live live live live forever fight right fight time live love share care pay accord work gotta live live live live live live forever live live live live live forever live love share care revolution revolution revolution revolution revolution revolution revolution revolution	personal
jon pardi	heartache medication	2019	country	dive work week drink bartender know mind kick strong serve right drinkin drinkin heartache medication strong dedication gettin turnin loose hardwood jukebox lose neon time heartache medication suit fine drinkin mind heartache medication girl dance country song turnin good time halfway feelin alright drinkin drinkin heartache medication strong dedication gettin turnin loose hardwood jukebox lose neon time heartache medication suit fine drinkin mind heartache medication single drinkin double teardrops turnin bubble yeah little later probably trouble drinkin drinkin heartache medication strong dedication gettin turnin loose hardwood jukebox lose neon time heartache medication suit fine drinkin mind heartache medication heartache medication takin away whoa	lifestyle
kongos	the world would run better	2016	blues	talk guess think right coffee make heavy thing light world spin solutions palm hand list things wish command say think ocean wave gotta behave world better argentina south closer house think world better world better say listen unique billion seven share feel look solve course drink think step change season spring say think ocean wave gotta behave world better argentina south closer house think world better world better world better world world better world world better	personal
