artist_name	track_name	release_date	genre	lyrics	topic
dirty heads	fear & love	2019	reggae	fear people tend tell stand complicate want fear wrap heart sage anoint skin braid hair tongue wind water clean good place begin away fear laughter tell run stop go tell run cause fear people tend tell stand complicate want fear yeah catch feel feel right sexual heal morning dolomite lose sight dice roll right life good time dynamite tell run stop go tell run cause fear people tend tell stand complicate want fear fear people tend tell stand complicate want fear	dark
ty segall	black magick	2017	blues	candle like goodbye goodbye picture rain aren matter cause understand need honesty black magic save black magic save kings queen black magic save save magic deep inside speak lie picture name matter matter cause understand tell cause need black magic save black magic save kings queen black magic save save black magic save black magic save black magic black magic black magic	dark
ab-soul	the law (feat. mac miller & rapsody)	2016	pop	tracklist click link backwards braille feat know feat threaten nature womanogomy invocation feat kokane wifey wifi feat beat straight crook feat schoolboy portishead morning world girl know drug evil genius feat teedra javonte lonely soul prelude feat miller rapsody album cover album cover	dark
dylan scott	ten feet away	2019	country	corner table watch watch singin flame burn hang word pour feel pour wine smoke beer perfectly clear touch mind feet away imagine arm look face lie shadowy place feet away know close song know heaven bind tell move stranger walk try best impress take eye leave say whoaowhoa night feet away imagine arm look face lie shadowy place feet away feet away imagine arm look face lie shadowy place feet away	sadness
mumford & sons	slip away	2018	rock	question lie deal surprise cause slip away slip away night wait patient rise reveal stoic smile slip away slip away night wait come suffer hold breath come suffer violence mind deal surprise cause slip away lyric commercial	sadness
seaforth	good and gone	2019	country	watchin sink glass girl think friday night clothe hide headphones say come know miss see round right cause go sittin sippin somethin little strong take shoot go wrong kill kill go happen fast years take weeks bounce kind get good move get good go yeah whiskey burn kinda taste like lesson learn swear drink hurt sayin good good go sittin sippin somethin little strong take shoot go wrong kill kill go happen fast years take weeks bounce kind get good move get good go get good go hurt comin baby right good go sittin sippin somethin little strong take shoot go wrong kill kill go happen fast years take weeks bounce kind get good move get good get good go get good move get good move get good go yeah kinda get good move get good go	emotion
robert randolph & the family band	got soul	2016	blues	wiedersehen wiedersehen meet sweetheart lovely fly away time come kiss like teardrops start true wiedersehen sweetheart	emotion
tedeschi trucks band	i pity the fool	2017	blues	pity fool say pity fool pity fool pity fool fall expect true pity fool look people know wonder stand watch fool lord look people know wonder stand watch fool pity fool pity fool fall pity fool say pity fool break heart leave walk away pity fool look people know wonder stand watch fool lord look people know wonder hell stand watch fool oooh look people know wonder stand watch fool look look look oooh stand right watch fool alright alright oooh pity fool pity girl fall pity girl want ahead yeah pity girl know gonna break heart someday lord pity fool pity pity pity fool lord lord somebody somebody know lord know know see kind yeah	sadness
keith urban	break on me	2016	country	days heart wanna beat pray breathe wanna fall piece nights call dream wall need break break shatter like glass come apart hand long take girl break head chest help forget heart need break break time know know change word wanna know turn hurt break shatter like glass come apart hand long take girl break head chest help forget heart need break break aaah aaah aaah need somebody need somebody right break shatter like glass come apart hand long take girl break head chest help forget heart need break break break break baby hmmmm	sadness
tia ray	trust myself (feat. gallant)	2019	jazz	bake bone strip clean fangs sparkle gleam claw drip freshly shed blood corpses mass fall moon rise darkest nights surprise distance howl beneath earth lurk foul body rise grind deafen ears hear sound dead free evil reings supreme gather demon clans light moon bake bone strip clean fangs sparkle gleam claw drip freshly shed blood corpses mass fall moon rise darkest nights surprise distance howl beneath earth lurk foul feast flesh live dead time mean dread gaze eye decay humanity fall toll	dark
bedroom	in my head	2017	rock	leave time speak consume mind consume soul want life want complete control somebody help somebody help dead feel time quiet lurk inside walk contradiction affliction somebody help somebody help dead	dark
soja	i found you	2017	reggae	spend time talk mirror talk cause eye open open wide truth life days pass faster hop watch grow apart separate heart open open wide need feel rain root root season change change circle star proof mind open open wide read news cancer try remove remove yeah seventy years life build family millions millions eye open open wide thank memories grow spend rest life people like land bar africa true mind wanna today face open eye morning rise truth	personal
q-tip	life is better	2019	hip hop	life fill come fall away play bangin gonna bang dont stop feel feel wanna breathe history tell story away oooo life better life better life better life better life better life better life better lyric commercial	personal
zedd	stay (with alessia cara)	2017	pop	wait time pass wind change change mind thousand reason know grow stay forever young live sofa drink cola underneath rise thousand reason go know stay minute time clock tick stay second hand clock tick stay stay admit know best let wanna spend night guess need need wanna grow stay forever young live sofa drink cola underneath rise million reason go know stay minute time clock tick stay second hand clock tick stay stay stay stay yeah stay minute time clock tick stay second hand clock tick stay stay	lifestyle
passafire	growing up	2017	reggae	need clear head gloves come grip question answer answer come time stand poker hand fall think short tall grow overrate hate know debate young dumb forever need things say voice loud face mean insensitive come rid wave uncertainty catch burn degree come space grow overrate hate know debate young dumb forever grow overrate hate know debate young dumb forever grow overrate hate know debate young dumb forever	dark
roots of creation	fire on the mountain	2018	reggae	think burn lie strengthen true turn back enemies motherfuckers jealousy stand world take adamant hell bend determine dominate resound anthem music connect unite mass strengthen unstoppable horde family world stand world take adamant hell bend determine dominate turn back enemies motherfuckers jealousy family world resound anthem resound anthem woah woah woah woah yeah yeah yeah yeah yeah yeah yeah resound anthem resound anthem resound anthem resound anthem	dark
the heavy	burn bright	2019	blues	walk wrong direction walk like wire couldn protection couldn stay dead heart keep beat stay dead cause head wouldn rise waitin salvation wanna alright know appear light burn brighter light burn brighter away pain break chain burn brighter burn impatience mile long mile keep busy worst locations stop follow light cause dance work devil dance go hours ready ramifications cripple inside know appear light burn brighter light burn brighter away pain break chain burn brighter light burn brighter light burn brighter away pain break chain burn brighter light burn brighter know light burn brighter away pain break outta chain burn brighter	sadness
six60	purple	2017	reggae	hold reach wait like thing control things shock girl electric blue stand wreck true fall leave purple heart battle purple purple purple night dream fall ceiling wake sound think feel grind shock girl electric blue stand wreck true fall leave purple heart battle purple purple purple imma shin imma shin battle know shin shin want shine imma shin fall leave purple heart battle purple purple purple	sadness
billie eilish	come out and play	2018	pop	hmmmm smell coffee half talk softly awfully quiet hmmmm quiet hmmmm piece paper little greater know hmmmm quiet know make nervous promise keep inside hide hide stay hide away come play look window snow leave home feel wind blow cause colder inside silence quiet yeah know make nervous promise keep inside hide hide stay hide away come play	sadness
muse	the dark side	2018	rock	live darkness life pursue afraid feel pain things able break break flee break break free lyric commercial	sadness
randy rogers band	tequila eyes	2016	country	look place shade neon face like hide smoky wall look good  midnight tear tequila eye make want save pain disguise come undo cause hide truth try right tequila eye notice walk stool need friend look like girl trouble past kill shoot glass catch tequila eye make want save pain disguise come undo cause hide truth try right tequila eye hide truth die tryin right tequila eye right tequila eye tequila eye tequila eye tequila eye	dark
swingrowers	butterfly	2017	jazz	butterfly butterfly butterfly butterfly butterfly butterfly story butterfly flutter dream dream reach dream hour hour brief life wake lullaby catch lift visit spaceship high butterfly butterfly butterfly butterfly butterfly butterfly butterfly today learn small gust wind change direction fate high butterfly come late mother nature dark feel strange situation flutter butterfly butterfly butterfly butterfly butterfly butterfly butterfly butterfly sky butterfly flutter star butterfly flutter sky butterfly flutter star butterfly flutter butterfly butterfly butterfly butterfly butterfly butterfly butterfly butterfly butterfly butterfly butterfly butterfly butterfly butterfly butterfly	personal
black rebel motorcycle club	king of bones	2018	blues	hand heart borrow time skin cold soul want tangle inside bone head blow like cannonball break bone want feel world outside stay bone stay like plastic toy break size stay bone stay like break bone wanna waste life table turn gonna skin grind gonna skin grind gonna skin grind gonna skin grind gonna skin grind gonna skin grind woah woah wowoah woah woah wowoah woah woah wowoah woah woah wowoah	dark
tedeschi trucks band	signs, high times	2019	blues	know float hop right sight fight rage tell maybe save sign high time fool sign high time choose seat sign high time right sign high time black white realize hatred eye fool darkness tell people save turn follow sound heartbeat get heavy heavy get ready sign high time fool sign high time choose seat sign high time right sign high time black white better mind cause right time good stake lie lord sign high time fool sign high time choose seat sign high time right sign high time black white people long hand call people long hand call people long hand call people long hand call	lifestyle
the score	higher	2017	rock	see world grind hear drum vein pump scrap knees bruise heart start run cause come noise life bring voice turn sing know life wait wait life fight fight dream soul know life lyric commercial	personal
krokus	rockin' in the free world	2017	blues	know run waste time know run waste time promise promise want want want time want want want time want want want time want want want time	lifestyle
dorothy	white butterfly	2018	blues	save come save come come save come save come come long years drag shame take toll weigh walk church look better hold head high ask forgiveness pride save come save come come save come save come come hurt ruthless regard consequences get high soul yeah lord selfish leave save come save come come save come save come come brimstone light light friend pain pain wipe tear eye home white butterfly save come save come come save come save come come save come save come come save come save come come	personal
axian	seasons change	2017	jazz	move westward ecliptic plane gravity induce axial change motion equinoxes relative fix star opposite gradual shift polar motion change alignment wobble rotation equatorial bulge inertial space planetary precession gravitational force diurnal motion celestial pole axial tilt change polar position years precession equinoxes cycle season change time earth obliquity orbital plane circumpolar star celestial pole stationary point zenith angle astronomical horizon vertical directions force gravity opposite nadir precessional eras constellations kochab pherkad guardians pole	personal
ron gallo	temporary slave	2017	blues	careful know mean work kid make buck week know seven grand thing spin wheel go toy apartment runnin bullshit smokestack mouth live couch stepcousins house try step dyin thing know cryin foot grave temporary slave life life life life hear street go people power people walk problem pluto mar head heart highway mercury vein toxic lunch cardboard punch foot grave temporary slave life life life life life life life life woah try step die thing know cry	personal
the wood brothers	can't look away	2018	blues	sweet little farmhouse gun ammunition driveway pickup truck shotgun rack camouflage paint path river good drinkin fishin  hit know blame look away look away look away look away step bathtub barely cover towel get door college street grass husband away neighbor peak blind cause know overseas lose fix hair let inside lemonade yeah look away yeah look away look away look away colorful sight dark light black white grey look away sweet little girl fold flag foot white blue turn black suit dress headlights rain notice headstone white bouquets leftover respect purple wildflower come dirt grave colorful sight dark light black white grey look away look away look away look away look away look away look away look away look away look away look away look away	sadness
mumford & sons	friend of the devil	2016	rock	reno trail hound sleep night till morning come runnin time friend devil friend home daylight sleep tonight devil babe loan bill spend night utah cave hill runnin time friend devil friend home daylight sleep tonight levee devil catch take dollar vanish runnin time friend devil friend home daylight sleep tonight reason away lonely night name sweet hearts delight second prison babe sheriff trail catch spend life jail wife chino babe cherokee say child look like runnin time friend devil friend home daylight sleep tonight runnin time friend devil friend home daylight sleep tonight	lifestyle
a perfect circle	the doomed	2018	rock	behold behold horde gather altaring begin word word death word light beatitude good luck bless fornicate bend  bless labour deliver bless envious bless slothful wrathful vain lyric commercial	dark
nai palm	molasses	2017	jazz	better better better better bear relic armor heart color sulfur banish single porcelain smolder forget state bury deep soil selfless daft compass rare bountiful oppose opinion point traction bind point let run eye close blind lens focus run eye close find omen woodwork cold cold braille mechanical frail tessellate filter rage bear relic armor heart color sulfur banish single porcelain smolder forget state bury deep soil selfless daft better better better better better better better better compass rare bountiful oppose opinion point traction bind point let	dark
dua lipa	kiss and make up	2018	pop	talk morning bang head bang head wall scar fall lose lose control tire talk feel say things important wanna lose wanna lose feel like break wanna kiss time touch like touch hand tire hear sorry kiss kiss kiss leave party cause want tire hear sorry kiss kiss kiss kiss kiss kiss kiss kiss kiss kiss kiss kiss kiss 언젠가는 마지막은 feel like break wanna kiss time touch like touch hand tire hear sorry kiss kiss kiss leave party cause want tire hear sorry kiss kiss kiss kiss kiss kiss kiss kiss kiss kiss kiss kiss kiss tell work thing work thing 그때처럼 tell work thing work thing kiss kiss touch like touch hand tire hear sorry kiss kiss kiss leave party cause want tire hear sorry kiss kiss kiss kiss kiss kiss kiss kiss kiss kiss kiss kiss kiss kiss kiss kiss kiss kiss kiss kiss kiss kiss kiss	emotion
cafe jazz deluxe	public syllogism	2016	jazz	start whisper dodge roar unify forceful waste need revolution destroy pattern separate time dare follow years wander circle hold get design latitudes ways channel define fragile neglect reroute remain reroute remain want look greed attention mountains cross will end treasure await years wander circle hold get design latitudes ways channel define fragile neglect reroute remain reroute remain design latitudes ways channel define fragile neglect reroute remain reroute remain	personal
govana	loyalty	2019	reggae	yeah breda breda thing breda breda thing loyalty bear till loyalty know real wass blind badmind crep elevation step determination pree face everyday bush face gorill place carrot gold plate drip open gate pree house land youth medz stop youth badmind brain wass blind badmind crep elevation step determination pree face weed blem hennessy pour grind fren enemy watch peep fence hold vibes fren pitbull pitbull dont jump cross fence link wass blind badmind crep elevation step determination pree face carm fan loyalty royalty press govan breda breda thing wass blind badmind crep elevation step determination pree face	dark
rudemanners	we walked together that night	2017	jazz	beauty eye behold burn brighter chase midnight streets speak freely care tomorrow hold felt world turn rise life kiss send reel unlike time yesterday come tomorrow life come alive past move aside regret remorse come come come machine luck fiction higher religion squeeze blood life goodnight silver wrong right world diamonds gold come realize happiness lie want know know come come come	personal
maddie & tae	die from a broken heart	2018	pop	momma wine stain favorite dress black mascara pillowcase cure onetoomany headache momma come maybe stay days weekend wine stain favorite dress sleep night momma nerve leave easy gonna alright wanna kick fall hard momma break heart daddy time come look door slam night close right promise tell pistol drawer momma gonna laugh someday drive away sleep night momma nerve leave easy gonna alright wanna kick fall hard momma break heart break heart knees prayin hard prayin hard blind cry dark dark real feel like feel sleep night momma nerve leave easy gonna alright sleep night momma nerve leave easy gonna alright wanna kick fall hard momma break heart break heart	sadness
j.j. cale	chasing you	2019	blues	road go replay mind afalling know chase time care days life phase time go gonna know chase time know story bring know story hard fact walk past think things change know chase time stand bring yesterday know chase know story bring know story hard fact care days life phase time go gonna know chase	personal
ella fitzgerald	you won't be satisfied (until you break my heart)	2018	blues	satisfy break heart satisfy teardrops start try shower lovin kiss naggin braggin poor heart raggin toss heart cryin shame wouldn like tearin dream apart satisfy break heart toss heart cryin shame wouldn like tearin dream apart hurt know cry satisfy	sadness
joe bonamassa	distant lonesome train	2016	blues	hear cold wind howl midnight pour rain hear baby voice distant lonesome train hear drum field cry pain spirit call barren grind distant lonesome train devil driver burn coal turn flame hell distant lonesome train travel cannonball passenger ride distant lonesome train distant lonesome train distant lonesome train distant lonesome train yeah	lifestyle
dirt rock empire	dirt road dollars	2017	country	lie reflect eye feel know know sleep night breathe right try lose mind go insane game know cause lose mind mind mind goodbyes start tire time know start sleep night breathe right try lose mind go insane game know cause lose mind mind mind oohooh mind mind mind lose mind oohoohoohoohooh oohooh mind mind mind cause lose mind mind mind	lifestyle
j.j. cale	stay around	2019	blues	stay stay girl time stay stay girl like fine slip away away night feel right stay stay girl time want know cook fit stay stay girl time slip away away night feel right stay stay girl time want know stay stay girl time	lifestyle
the comet is coming	blood of the past	2019	jazz	corpses begin speak ignorance argue anymore late plead white picket dream print shemps world shrink root trivial concern need face drown voice imagine culture root soulful connection land love ones hear speak progress hungry black wrists cuff white shirt tube distractional picture picture beer guilt urge sexual distrust abandon nothingness nail sharplydressed talk head trust despise windows open design stay close shower smoothie coffee commute check internet stop stop scar soul world need look blood past remain blood murder body like sack leak brain stack chest aback plan remain acknowledge guilt accept condition listen people tell behave truth feel move hear clatter bone steel come still scorch white reflection sunlight glass bounce sunlight glass bounce industrialize denial business usual roll eye shake head turn away name okay proud unable listen speak moted blood unable notice unable stop unwilling learn	dark
jitwam	whereyougonnago?	2017	jazz	lift wanna wanna luck fall know safe sound safe sound know river evaporate world appreciate luck hurricane frown know safe sound safe sound safe sound safe sound safe sound hold grind safe sound safe sound tidal wave mystery stand luck feet underground know safe sound sound sound sound safe sound sound sound sound safe sound safe sound hold grind safe sound lift wanna wanna luck fall know safe sound lift wanna wanna luck fall know safe sound safe sound safe sound safe sound safe sound safe sound safe sound safe sound safe sound hold grind safe sound safe sound safe sound	sadness
masayoshi takanaka	samba pati	2018	jazz	handle handle mistake base groin little things pant live know thing kill kill brain brain brain brain brain brain hurt anymore nevermind kill wicked today think hardcore forget medicine sick trot steal beat black young girls steal kill kill brain brain brain brain brain brain hurt anymore nevermind kill brain ahoh ahah ahoh ahah stand stand stand stand wonderful misunderstand everybody reason little things pant wait know thing kill kill brain brain brain brain brain brain hurt anymore nevermind kill ahoh ahah ahoh ahah	dark
astrid s	hurts so good	2016	pop	fight like firefighter tell burn liar cause time yeah night tell want complicate complicate hurt hurt good break hurt hurt good like nanana like nanana hurt good nanana like nanana hurt good time swear make want pull away come closer stay tear baby know night tell want complicate complicate hurt hurt good break hurt hurt good like nanana like nanana hurt good nanana like nanana hurt good wide awake daylight hold like run yellow light reach hand tie dance like burn paradise hurt hurt good break hurt hurt good like nanana like nanana hurt good nanana yeahyeah yeahyeah like nanana hurt good	sadness
the neighbourhood	you get me so high	2018	rock	regret push forget credit hear say plan long time take grant think time manage leave meet inbetween high time high time wanna high time come wish doubt lyric commercial	lifestyle
jahmiel	strongest soldier	2017	reggae	hizzle heap heap hate chimney streets affi friends family fail step vehcs piece enemies stop pree tell strongest soldier hardest fight realest people live hardest life shin darkest nights better days heap heap hate heap snake face cause time chimney work race swift endure tell strongest soldier hardest fight realest people live hardest life shin darkest night better days yeah yeah yeah yeah watch fight come great enuh drop pinnacle survive chat miracle think crash vehicle evil people dawg reason cyan stop bless teach real lesson tell strongest soldier hardest fight realest people live hardest life shin darkest nights better days	personal
omaure	down under	2018	jazz	space look lasers think private live think kind true escape watch time metal circuit gleam perpetual country clean elect electric protect electric focus feel stare zoom know pride probe secret move tearless retina take picture prove metal circuit gleam perpetual country clean elect electric protect electric electric feel stare develop expose fee think power grow metal circuit gleam perpetual country clean elect electric protect electric protect detective electric	dark
leaf beach	warm brew	2017	jazz	death come redemption waga teki kurau ears sound	dark
