artist_name	track_name	release_date	genre	lyrics	topic
j. roddy walston & the business	bad habits	2017	blues	pray public open tell mother come afford charge things gotta things worse steal credit card sixteen months drink lonely sober habit habit best reason things habit habit best hate mnemonics repetition believe rote memory recall easily hell know ride bring mortgage money dear thousanddollar nights smoke marlboro light cancer worse fear sixteen months drink lonely sober habit habit best reason things habit habit best cop doin oneself life break wife death come hell sixteen months drink lonely sober habit habit best reason things habit habit best habit habit best	personal
kehlani	feels	2019	pop	 real contemplate bout feel hard think true want minute fall ceiling know right start limit catch feel baby feel know know know real feel feel know know know real feel take hard  learn break stop baby matter see past impact grow baby slip away drift away waste waste straight straight face contemplate yeah contemplate baby want minute fall ceiling yeah know right start limit catch feel baby feel know know know real real feel feel feel know know know real feel feel feel feel feel feel feel feel feel feel feel know know know real real feel feel know know know real know real feel feel	emotion
josh turner	never had a reason	2017	country	reason stay home friday nights content unwind heat cast iron skillet lazy sunday morning scramble egg brew coffee learn cook reason smile wake world eye lose girl life reason leave note counter tell girl live things think cause reason smile wake world eye lose girl life smile wake world eye lose girl life reason folks asleep gotta meet felt want hometown reason reason	personal
dierks bentley	living	2018	country	mornin walk rise drink like whiskey tree see thousand time branch watch away wind beautiful world clear days breath break heart poundin chest beatin days forget give days days alive days livin days livin go fire coffee walk kitchen like tshirt kill kiss like time laugh look like lose mind say baby live know days breath break heart poundin chest beatin days forget give days days alive days livin days livin like blue little bluer high little high feel miss days live beautiful world clear days start singin need reason world right clear eye blinkin heart grateful give days yeah days alive days livin days livin livin like blue little bluer high little high feel missin days live days live	personal
death from above 1979	all i c is u & me	2017	blues	racists smile friendly face walk shake hand try fake need fail glass season pass peepshow seat cheaper romance dead ghost haunt favourite place romance dead ghost haunt favourite place children drool famous face wish trade place shout mime tasteless know theory sober morning bore know lazy away crazy crazier better tell fear ghost haunt underneath porno magazine taunt romance dead ghost haunt favourite place romance dead ghost haunt favourite place romance dead ghost haunt favourite place	dark
car bomb	secrets within	2016	jazz	eye drain skull pull plug things want know secrets secrets consequences stop violent face occupy metastasis secrets secrets secrets secrets lock hide inside wall know blindside polite thank rebirth birth rebirth stay cause stay cause lose things stay cause secrets secrets secrets secrets secrets secrets secrets secrets secrets secrets stay cause stay cause lose things lock hide inside wall blindside compassion save apart insides realize lie lie lie freeze lips lie lie lie allow retreat rebirth lock hide inside wall know blindside polite thank rebirth rebirth	sadness
tracy lawrence	running out of people to blame	2019	country	gonna look mirror sudden things gonna clearer trail destruction leave place hide late life pass runnin time runnin answer burnin road second chance ways wind blow hellbent bind roll everybody pray someday change run people blame walk shoe yeah live advice gonna know feel prove cost loose runnin time runnin answer burnin road second chance ways wind blow hellbent bind roll everybody pray someday change run people blame selfish little game runnin time runnin answer burnin road second chance ways wind blow hellbent bind roll everybody pray someday change run people blame	personal
train	play that song	2017	pop	play song make night long make think gotta mister gonna spin baby favorite record wait minute invite friends buy round dolled gonna play song gonna earn gonna play song say play song make night long make think gotta play song make stay till make gotta guitar gonna strum girl hear song play cause love hook finger pick throw money mister gonna play song gotta hesitate gonna play song say play song make night long make think gotta play song make stay till make gotta till baby moooooove moooooove moooooove moooooove till baby moooooove moooooove moooooove moooooove come play song make night long make think gotta play song make stay till make gotta	lifestyle
weldon irvine	morning sunrise	2016	jazz	morning sunrise morning sunrise hello morning look good good kiss feel share morning kiss sunrise eye morning sunrise morning morning sunrise say beautiful morning sunrise morning sunrise hear yeah yeah morning sunrise flower bloom spring like nature bring morning sunrise life bring morning sunrise morning morning sunrise morning sunrise say beautiful morning sunrise morning sunrise hear yeah yeah morning sunrise morning morning sunrise yeah morning sunrise	emotion
haken	initiate	2016	jazz	pain engage sense carve focus focus sharpen view initiate live forever observe world jar turmoil million people wag hand hear cry cold fire blaze affliction fast consume fascinate drift deeper life death unknown initiate dream forever tear wander prepare stay die things believe tomorrow memories things conceive string open floodgates form colour shape light initiate sense engage open floodgates pain light initiate sense engage distance tell stretch feel breathe home initiate drift drift deeper deeper unknown	personal
gregory porter	smile	2017	jazz	smile heart ache smile break cloud smile fear sorrow smile maybe tomorrow come shin light face gladness hide sadness tear near time try smile cry life worthwhile smile light face gladness hide sadness tear near time try smile cry life worthwhile smile	sadness
unified highway	we can't fall (feat. courtney panton jr.)	2016	reggae	trade stay cyah crown hear rastaman whoa stand unite fall whoa stand unite fall whoa stand unite fall whoa stand unite fall fall fall fall fall fall fall fall fall fall fall fall fall fall fall fall trade stay cyah crown hear rastaman whoa stand unite fall whoa stand unite fall whoa stand unite fall whoa stand unite fall fall fall fall fall fall fall fall fall fall fall fall fall fall fall fall fall fall fall fall fall	sadness
h.e.r.	every kind of way	2017	pop	baby sound better want mind hold closer dream better wanna time night wanna kind wanna matter long take world tomorrow today gonna kind need cause need wanna fall like favorite season stay forever babe better kiss wanna kind wanna matter long take world tomorrow today gonna kind wanna kind wanna matter long take world tomorrow today gonna kind wanna gotta wanna gotta	personal
joe bonamassa	what i've known for a very long time	2016	blues	matter cause chase street misery wait recognize know long time long years walk door search give wait recognize know long time trouble baby time time hours need best friend finally sleepless nights make make right girl strong baby good need chase street misery cause wait recognize know long time trouble baby time time hours need best friend finally sleepless nights make make right girl strong baby good need chase street misery cause wait recognize know long time	lifestyle
khalid	hopeless	2017	pop	spend time worry break promise focus smell burn cigarettes thoughts play repeat comfort cause moment forget hopeless hopelessly romantic strand blue blue blue tell regret know wasn try best surround question like ways memory right leave hopeless hopelessly romantic strand blue blue blue lift higher guess time expire give match hopeless hopelessly romantic strand blue blue blue tell regret know wasn try best surround question like ways memory right leave hopeless hopelessly romantic strand blue blue blue yeah blue blue blue yeah blue blue blue	lifestyle
three days grace	right left wrong	2018	rock	wanna away away away wanna disappear away come undo time come time come leave right leave right leave wrong know go move move move think lyric commercial	sadness
metallica	moth into flame	2016	rock	black queen amphetamine scream crash silence tap douse gasoline high time go timeless decadence death innocence pathway start spiral infamy publicity destruction go viral light light erase pain bulletproof kill truth fall think fly high high sell soul build higher wall yesterday throw away rise fall care seduce fame moth flame twist backstabbing wicked delusion absolution perjurer fame murderer seduce ruin light light erase pain bulletproof tell truth fall think fly high high sell soul build higher wall yesterday throw away rise fall care seduce fame moth flame burn guarantee kill vultures feast overdose shame insecurity fistful death scene black hearse limousine grave fill seduction vaccine fame murder build destruction light light erase pain bulletproof excuse fall think fly high high sell soul build higher wall yesterday throw away rise fall care seduce fame moth flame addict fame	dark
two door cinema club	once	2019	rock	away sugar dance tongue grow stay young get stick paper magazines luck strangers live dream lifetime away soon break wave live company play wall suddenly miss keep soon gonna know certain lifetime away soon break wave live break wave lifetime away soon break wave live break wave	sadness
kelsea ballerini	legends	2018	country	golden magic yeah know name middle madness neon grey crowd yeah write story blood sweat heartbeats fame go history yeah legends love baby heaven wonder question close eye take world remember crazy tragic epic amaze wear crown give stay lose forever remember legends like write permanent marker brightest fade come whichever hell high water write story blood sweat heartbeats fame legends love baby heaven wonder question close eye take world remember crazy tragic epic amaze wear crown give stay lose forever remember legends woah legends love baby heaven wonder question close eye take world remember baby crazy tragic epic amaze wear crown give stay lose forever remember legends yeah legends yeah write story	personal
soccer mommy	your dog	2018	rock	want  drag collar neck tie pole leave freeze cold want little edge sleep body stretch guess curl couch talk people lyric commercial	dark
the score	revolution	2017	rock	wolves begin howl time ohoh hear drum ohoh revolution come wide awake fever burn sweat bring turn hear drum revolution come doubt creep inside shed skin hear drum revolution come wait life live dream steal kill time pass chase block face face wolves begin howl time ohoh hear drum ohoh revolution come lyric commercial	dark
l'indécis	sunrise drive	2016	jazz	breath suffocate mediocrity lose battle daily cement sentiment sentimentally die directionless drivel sixgun surprise save little leave die	dark
gary hoey	boxcar blues	2016	blues	boxcar blue early morning try school start shake better hold hear whistle blow boxcar blue cars come watch wheel round start jump run till grind train leave station know hear whistle blow boxcar blue boxcar blue early morning try river cross hear whistle blow boxcar blue boxcar blue boxcar blue boxcar blue boxcar blue boxcar blue	lifestyle
cody jinks	no words	2016	country	view word change guess come believe good like drink see floor spend lifetime cage build bangin doors word need life lead live heaven know break heart away promise stand like stand word need life lead live better know thats word better know thats word	personal
adelitas way	notorious	2017	rock	notorious notorious notorious notorious livin givin  like land sheep feel teeth sink deep rebell soul bone ready everybody want wear crown line knock notorious notorious exactly stand stand lyric commercial	dark
thomas rhett	life changes	2017	country	wakin college dorm yeah life pretty normal lookin date spring formal wasn worry bout nothin majorin undecided notebook songs writin dream like sittin walmart shelf funny life change nuttin life change stop train know gonna happen plan hear laughin life change wouldn change world world wouldn change world world buy ring say lyric commercial	personal
dierks bentley	woman, amen	2018	country	ohhhhhh ohhhh ohhhhhh lose lose mind face know save night give drifter heart home night knees lord know near thank woman amen ohhhhhh ohhhh world shake break need crack shatter heart cause get night knees lord know near thank woman amen give ohhhh give ohhhh give ohhhh give strength ohhhh give ohhhh ohhhh thank woman amen ohhhh ohhhhhh ohhhh ohhhhhh thank moon star forgiveness undying twist turn sure roads tonight fall knees cause lord know gonna shout lungs thank woman amen thank woman amen give ohhhh give ohhhh give ohhhh give strength ohhhh give ohhhh ohhhh thank woman amen ohhhh	personal
post malone	blame it on me	2018	pop	free people wanna takin piece away need hold drown spit right teeth pretend wind blow breeze breeze hurricanes inside brain rain look easy look away pain pain watchin bleed knees matter believe think agree blame fault fault fault blame fault fault fault couldn breathe lose couldn stop blame fault fault fault yeah watch scrape away impossible yeah play game tryna nearly lose dead people time watch face ceilin roof like space take chance blame fault fault fault blame fault fault fault couldn breathe lose couldn stop blame fault fault fault fault fault addict clothe fault pay cost yeah fault givin soul fault watchin bleed watchin bleed knees knees matter believe think agree blame fault fault fault blame fault fault fault couldn breathe lose couldn stop blame fault fault fault fault fault fault blame yeah fault fault fault	sadness
passion	build my life	2017	rock	song sing praise bring breath breathe live save breath breathe live holy like open eye wonder heart lead song sing praise bring breath breathe live save lyric commercial	dark
des rocs	dead ringer	2019	blues	hold cigarette burn baby dead ringer sick look amaze voice night come like cool summer rain know hangin stay stay stay face night look like television saint name bright light lady hand trigger point dead ringer hold cigarette burn baby dead ringer sick look amaze hold cigarette burn baby dead ringer sick look amaze reflection time worst game nothin like shake life stick race race race race race hell catch little break smile fittin pain pain pain pain pain lady hand trigger point dead ringer hold cigarette burn baby dead ringer sick look amaze hold cigarette burn baby dead ringer sick look amaze yeah yeah think hurt yeah yeah dead ringer mean yeah yeah think hurt yeah yeah dead ringer mean hold cigarette burn baby dead ringer sick look amaze hold cigarette burn baby dead ringer sick look amaze dead ringer sick	dark
jason isbell and the 400 unit	white man's world	2017	country	white live white world roof baby girl think world momma know better white live white want shoot cocaine burn momma want change nashville sound gonna thing creature comfort aren things fight breathe late carry burden share fate white live white street bone feet highway run burial ground past oceans cotton white look black eye wish guy pretend hear white joke time forget thing creature comfort aren things fight breathe late carry burden share fate white live white nation think upstairs take vacation know maybe little girl eye maybe little girl eye	dark
walshy fire	call me	2019	reggae	zagadat gyal kranisay lonely yeah kranium zagadat lonely yeah woman woman healer sweetheart sweetheart zagadat jinja woman woman kranium healer sweetheart sweetheart jinja zagadat kranisay come wait come care yeah cyaan refuse lose worry ptotected things zagadat eazi sing yeah lonely yeah baby girl zagadat lonely yeah woman woman healer sweetheart sweetheart zagadat jinja woman woman healer sweetheart sweetheart jinja kranium zagadat whine likkle lady feel like virgin chill glats lady look torch like suppose woman need baby complain come know zagadat kranisay lonely yeah kranium zagadat lonely yeah woman woman healer sweetheart sweetheart zagadat jinja yeah woman woman healer sweetheart sweetheart jinja zagadat zagadat original copycat girl relax youself sharp animal zagadat original copycat girl	emotion
iya terra	follow your heart (feat. zion thompson from the green)	2019	reggae	wish atlas path feel like go astray know long hard journey go wouldn heart guide focus mission step time analyze vision fall line know gonna okay word ring true want feel spirit darkest days follow heart days hard remember purpose long learn journey season reason follow heart follow heart feel follow heart cause everybody look future want cause crumble tomorrow feel sorrow wonder cause know change near afraid move know grow gonna stop know feel like like remember stay strong weather follow heart days hard remember purpose long learn journey	personal
kygo	remind me to forget	2017	pop	fade away stay kiss like break glass skin greatest love violence tear voice leave silence baby hard hold chest maybe leave remind forget matter regret cause baby scar remind forget remind scar forget remind forget leave burn heart leave remind forget leave burn heart leave skin leave burn heart leave remind forget leave burn heart leave skin room feel hurt core heal know good try forget memories baby hard hold chest maybe leave remind forget matter regret baby scar remind forget leave burn heart leave remind forget leave burn heart leave skin remember tell save alright hurt like need mementos alright yeah baby hard hold chest maybe leave remind forget matter regret baby scar remind forget leave burn heart leave remind forget leave burn heart leave remind forget	sadness
khalid	saved	2017	pop	hard forever forget aren deep heart alright time time think aren number save cause sense hop miss miss number save cause pride tell gonna hold alright try stuff go erase picture phone heres number save cause sense hop miss miss number save cause pride tell gonna hold think time share finally realize care crazy thing unfair like number save cause sense hop miss miss number save cause pride tell gonna hold number save cause sense hop miss miss number save cause pride tell finally finally	personal
diana krall	but not for me	2018	jazz	write songs lead cloud grey russian play guarantee fool fall heighho alas lackaday plot turn marriage knot guess	lifestyle
charlie puth	one call away	2016	pop	away save superman away baby need friend wanna reach matter know away save superman away come scar wanna free stay cause know wanna smile matter know away save superman away weak strong gonna hold worry long darling feel like go arm away save superman away save superman away away	sadness
dirty heads	horsefly	2019	reggae	say life live know things passionate sound real adamant  come sentiment try losses horse race track track offense say yeah yeah dream speak cross list feel like feel like thousand reason feel good right good right feel like feel like thousand reason feel good right good right know cause wanna condolences follow path long path hard apologies need repeat know cause heart feel revel revel revel second devil devil devil inside head go away people style tell real  fake feel like feel like thousand reason feel good right good right feel like feel like thousand reason feel good right good right feel like feel like thousand reason feel good right good right feel like feel like thousand reason feel good right good right feel like feel like thousand reason feel good right good right feel like feel like thousand reason feel good right good right	emotion
albert castiglia	hoodoo on me	2017	blues	breathe like smoke taste cuban toke best years hold reverie reverie run time waste run run mind awaken awaken look light hold try lose fear run mind run mind stay tonight better night better run mind run mind run time waste run run mind awaken awaken look light hold try lose fear run mind run mind stay tonight better night better	lifestyle
black pistol fire	hearts of habit	2017	blues	record little late wrong go know better baby know better break heavy heart holy rollers hearted cryin door hidin cold shoulder hearts shatter bruise batter hang rafter come wait tire break smile know better baby know better break heavy heart holy rollers hearted cryin door hidin cold shoulder heart shatter bruise batter hang rafter come wait misery doubt hand eye wave white flag know hard know better baby know better break heavy heart holy rollers hearted cryin door hidin cold shoulder heart shatter bruise batter hang rafter waitin	sadness
leprous	stuck	2017	jazz	reborn shiny dream spark childish head safety rope afraid turn force grow finish alive time tell cling shaky line insecure mount unstable peak overwhelm stick mountains mountains doubt stick mountains mountains apathy near seek goal turn dream fight image change silently turn steep stay away self pity sleep wrong stick mountains stick mountains mountains doubt stick mountains mountains apathy stick mountains mountains doubt stick mountains mountains apathy home strong home strong	dark
the dear hunter	the revival	2016	jazz	take little longer hop know take village raise scheme patch hole mausoleum pack patronage like lotto everybody win seat start welcome work beautiful maybe entertain swear minute contain release couldn estimate secret safe long good leave walk away pretend wash hand sunday squaws room leave gift long overdue sultan right troglodyte life party socialite look efface retire bother doubt contain release couldn estimate secret safe long good leave walk away pretend wash hand candidate give bruise night dissociate think rule apply long road wander short temperance live help build deify czar blame tie knot wrists noose surely wily life live sale soul fall foolish young better withdraw contain release couldn estimate secret safe long good leave walk away pretend wash hand	sadness
marcus miller	7-t's	2018	jazz	right super fair minute right super fair minute right super fair minute ahaaa right super fair ahaaa minute right super fair	lifestyle
john mayer	changing	2017	rock	change change young change change change wonder change stop run go home build lyric commercial	personal
jordan rakei	mad world	2019	jazz	stay away motion madness stay away streets hide away moment makers hide away streets world world world world live yeah world live yeah world hide secrets complete stray away force stray away seat world world world world live yeah world live yeah world world world world world live yeah world live yeah world world world world world world world world world	personal
ocean alley	bones	2018	reggae	feel feel rattle bone want wanna clothe warn cold morning feel feel away feel wrong time home reason finally reason reason reason reason feel feel weight stone want want finally leave come transcend crawl wall ceiling ceilings crumble know wrong time reason finally reason reason reason reason	personal
ed sheeran	save myself	2017	pop	give oxygen people breathe give away money speak drive honestly offer shoulder give constant shelter warm give heartache return give song go life numb feel drown drink outofdate prescription pills ones leave shelf farewell save save give energy take away pain cause human be destine radiate drain line stand cause look scar remain life numb feel drown drink outofdate prescription pills ones leave shelf farewell save save rescue stranger need save like devil danger guess nature wrong cause like cause smile complain song help save save life numb feel drown drink outofdate prescription pills ones leave shelf farewell save save blame save	personal
louis the child	love is alive	2017	pop	sure sinkin feet sand right island understand oooooh yeah feelin feelin oooooh yeah come quick come quick wanna alive alive alive wanna alive alive alive alive prove unafraid lose wanna alive gonna wanna alive wanna alive chaos surrender changin currents tide water gettin deeper cause right stayin oooooh yeah feelin feelin oooooh yeah come quick come quick wanna alive alive alive wanna alive alive alive alive prove unafraid lose wanna alive gonna wanna alive gonna wanna alive alive alive wanna alive alive alive alive prove unafraid lose wanna alive gonna wanna alive wanna alive gonna yeah feelin feelin yeah come quick come quick yeah feelin feelin yeah come quick come quick wanna alive alive alive wanna alive alive alive alive prove unafraid lose wanna alive gonna	dark
lester nowhere	balcony	2017	jazz	leave away biggest baby leave away heart baby girl want stay like hard slip away come leave tomorrow come regret things say today like hard slip away come leave tomorrow come regret things say today leave away biggest baby girl baby mama lovin	sadness
prettymuch	open arms	2017	pop	prettymuch try baby start face fact whoa cuff know catch slippin need wanna touch turn away whoa girl tear apart help waitin open arm ready know heart scrape knees pavement open arm ready know wait phone brrp ringtone know like ask whoa cuff cuff cuff know catch slip need wanna touch yeah turn away yeah yeah yeah yeah girl tear apart help waitin open arm ready know heart scrape knees pavement open arm ready know yeah ready ready ready ready ready ready ready ready ready know ready ready ready yeah know ready ready ready ready ready ready girl waitin phone ready ready ready wait ready ready ready wait come baby ready ready ready baby know ready girl tear apart help waitin tear apart baby open arm ready know heart heart scrape knees pavement open arm ready know know	lifestyle
